{
  "$schema": "../schema/instrument.schema.json",
  "id": "cert-in.directions-70b.2022",
  "issuer": "CERT-In",
  "title": "Directions under sub-section (6) of section 70B of the Information Technology Act, 2000 relating to information security practices, procedure, prevention, response and reporting of cyber incidents for Safe & Trusted Internet",
  "reference_no": "No. 20(3)/2022-CERT-In",
  "issued_on": "2022-04-28",
  "in_force_from": "2022-06-27",
  "in_force_until": null,
  "url": "https://www.cert-in.org.in/Directions70B.jsp",
  "source_sha256": "202c2f3953d792dcfb3ecb3634fc82ab75437ee596de89b8d59a211e8e42431f",
  "retrieved_at": "2026-09-24T15:11:49Z",
  "language": "en",
  "status": "in_force",
  "supersedes": [],
  "superseded_by": [],
  "document_type": "direction",
  "provenance": {
    "parser_version": "pymupdf-1.28.2",
    "extraction_date": "2026-09-24T15:11:49Z"
  }
}
